facname,addressnum,streetname,address,boro,zipcode,datasource,uid,grc,message
COMMUNITY LIFE CENTER 2,,15 MT,15 MT MORRIS PK,,,acs_daycareheadstart,9a68550b09248bb6101db07d0bf200fe,EE,'15 MT' NOT RECOGNIZED. THERE ARE 003 SIMILAR NAMES.
EPISCOPAL HS - PAULS HOUSE,500,BERGEN STREET,500 BERGEN STREET,,,acs_daycareheadstart,43c417c59339fcbc88ce6adcca65c7f9,EE,'BERGEN ST' NOT RECOGNIZED. THERE ARE 005 SIMILAR NAMES.
HAMILTON MADISON HOUSE #4,77,MARKET,77 MARKET,,,acs_daycareheadstart,1baed41e65177ad7ea085ae2c8cf6654,EE,'MARKET' NOT RECOGNIZED. THERE ARE 010 SIMILAR NAMES.
MORNINGSIDE DAY CARE CTR,2967,FREDRICK DOUGLASS,2967 FREDRICK DOUGLASS,,,acs_daycareheadstart,d3e869fe82431b47e1a250a0826c391f,EE,'FREDRICK DOUGLASS' NOT RECOGNIZED. THERE ARE 010 SIMILAR NAMES.
NEPTUNE AVENUE HEAD START,293,NEPTUNE,293 NEPTUNE,,,acs_daycareheadstart,1356f503598a6f79ee7b9767be787250,EE,'NEPTUNE' NOT RECOGNIZED. THERE ARE 004 SIMILAR NAMES.
ROCHDALE VILLAGE KDG III,,AVENUE BSMT,170-10 130TH AVENUE. BSMT,,,acs_daycareheadstart,cfa55be34bd4132d7b92d210d8484e25,EE,'AVENUE BSMT' NOT RECOGNIZED. THERE ARE 010 SIMILAR NAMES.
SOUTH JAMAICA CENTER 1,,,114-02 GUY R. BREWER,,,acs_daycareheadstart,7495497783d41de42bb1f577332f4ac2,16,STREET NAME IS MISSING
SUNSET BAY COMMUNITY SER. INC,199,14 TH STREET,199 14 TH STREET,,,acs_daycareheadstart,fd0673aabe8fb5d21945715e6eb63768,EE,'14 TH STREET' NOT RECOGNIZED. THERE ARE 003 SIMILAR NAMES.
YWCA - BROWNSVILLE ELC,1592,EAST NEW YORK,1592 EAST NEW YORK,,,acs_daycareheadstart,bf96a54854204203ab45109a2e2c6e36,EE,'EAST NEW YORK' NOT RECOGNIZED. THERE ARE 004 SIMILAR NAMES.
,,,,,,acs_daycareheadstart,4fa162e868e1c23b33568e4743cca49c,98,NO INPUT DATA RECEIVED
"CASINO AUTO BODY, INC",354,BEACH 72 STREET,354 BEACH 72 STREET,,11692,dca_operatingbusinesses,aaffb5c28e09867ecc0585d87ef428fc,00,
EASTERN TOWING & RECOVERY INC.,38,SOUTH MACQUESTEN PARKWAY,38 SOUTH MACQUESTEN PARKWAY,,,dca_operatingbusinesses,3023a23123d2cdb522c1c5a2afc6e1e2,11,'S MACQUESTEN PKWY' NOT RECOGNIZED. THERE ARE NO SIMILAR NAMES
JFK AP LLC,1,JFK INTL AIRPORT BOULEVARD,1 JFK INTL AIRPORT BOULEVARD,,,dca_operatingbusinesses,db3816fa901a53eb08a69b703264eac2,EE,'JFK INTL AIRPORT BLVD' NOT RECOGNIZED. THERE ARE 010 SIMILAR NAMES.
SP PLUS CORPORATION,95,OCEANA DRIVE EAST,95 OCEANA DRIVE EAST,,,dca_operatingbusinesses,c912dce04be4fed6c783d543110f35e6,42,ADDRESS NUMBER OUT OF RANGE
"4HEADS, INC.",1022,PACIFIC STREET,1022 PACIFIC ST,,,dcla_culturalinstitutions,863450bfa44dcd0d1a1356e80a5689e8,EE,'PACIFIC ST' NOT RECOGNIZED. THERE ARE 003 SIMILAR NAMES.
AACCAPELLA LIGHT SOUND ORGANIZATION PLUS,851A,PROSPECT AVENUE,851A PROSPECT AVENUE,,,dcla_culturalinstitutions,64eb56606fb3491c6e4122ea67e8af69,42,ADDRESS NUMBER OUT OF RANGE
"ACADEMY OF BOSNIA AND HERZEGOVINA, INC.",55-23,31 AVENUE,55-23 31ST AVENUE,,,dcla_culturalinstitutions,2bf8f622f81edf525bbf4eb424934151,EE,'31ST AVENUE' NOT RECOGNIZED. THERE ARE 002 SIMILAR NAMES.
"ALARM WILL SOUND, INC.",51,WOOSTER STREET,51 WOOSTER STREET,,,dcla_culturalinstitutions,e9e5b0c58c5e75286c1a65e353280958,EE,'WOOSTER STREET' NOT RECOGNIZED. THERE ARE 010 SIMILAR NAMES.
"ALVIN AILEY DANCE FOUNDATION, INC.",,,THE JOAN WEILL CENTER FOR DANCE,,,dcla_culturalinstitutions,26e71e291711c2c94724a49fb8479d3f,16,STREET NAME IS MISSING
AMERICA SCORES NEW YORK,,,AMERICA SCORES NEW YORK,,,dcla_culturalinstitutions,f72c51799b874ba91cd67a3b80670e8e,16,STREET NAME IS MISSING
AMERICAN LATIN ASSOCIATION OF NEW YORK,14,WEST 170 STREET,14 WEST 170TH ST,,,dcla_culturalinstitutions,849818012a5e0a3024429887f2399b95,11,'WEST 170TH ST' NOT RECOGNIZED. THERE ARE NO SIMILAR NAMES
AMERICAN MUSEUM OF NATURAL HISTORY,,PARK WEST AND 79 STREET,CENTRAL PARK WEST AND 79TH STREET,,,dcla_culturalinstitutions,a5ff3bb4f17a348d90e1bc8af129c726,EE,'PARK WEST AND 79TH STREET' NOT RECOGNIZED. THERE ARE 010 SIMILAR NAMES.
AMERICAN NUMISMATIC SOCIETY,,WEST 155 STREET,BROADWAY 155TH STREET,,,dcla_culturalinstitutions,47fa52db3280a614f2126d7276b1046c,13,ADDRESS NBR BROADWAY  HAS AN UNKNOWN OR INVALID SUFFIX/ENDING.
"ANNE FRANK CENTER USA, INC.",44,PARK PLACE 100 CHURCH STREET,44 PARK PLACE 100 CHURCH STREET,,,dcla_culturalinstitutions,e64146f1cd807aae05339be4396ac3f8,EE,'PARK PLACE 100 CHURCH STREET' NOT RECOGNIZED. THERE ARE 010 SIMILAR NAMES.
"ART CREATES US, INC.",601,WEST 26 STREET,601 WEST 26TH ST,,,dcla_culturalinstitutions,28e4399dbad6d711b13ed7e7e2933488,11,'WEST 26TH ST' NOT RECOGNIZED. THERE ARE NO SIMILAR NAMES
"ART KIBBUTZ, INC.",500,WEST 235 STREET,500 W 235TH STREET,,,dcla_culturalinstitutions,d4194210ecb24710049b1c5a2397bacf,11,'W 235TH STREET' NOT RECOGNIZED. THERE ARE NO SIMILAR NAMES
"ARTBRIDGE PROJECTS, INC.",601,WEST 26 H STREET,601 WEST 26H STREET,,,dcla_culturalinstitutions,9fbef7fddb34c8c5eae15a6a2cdf0bb7,EE,'WEST 26H STREET' NOT RECOGNIZED. IS IT 'WEST   26 STREET'?
"ARTEEAST, INC.",300,CADMAN PLAZA WEST,300 CADMAN PLAZA WEST,,,dcla_culturalinstitutions,cfc54f3f68bf0bcad55d3c403da2f4dc,EE,'CADMAN PLAZA WEST' NOT RECOGNIZED. THERE ARE 003 SIMILAR NAMES.
"ARTISTIC NOISE, INC.",315,FLATBUSH AVENUE,315 FLATBUSH AVE,,,dcla_culturalinstitutions,16402a70ad16f90db85ae060b455caf6,EE,'FLATBUSH AVE' NOT RECOGNIZED. IS IT 'FLAGS H S'?
ARTS INDONESIA,49,INDIA STREET,49 INDIA ST,,,dcla_culturalinstitutions,697fc97b7e1e7738cc71c6f1649495c9,EE,'INDIA ST' NOT RECOGNIZED. THERE ARE 010 SIMILAR NAMES.
"ASDT, INC. - THE AMERICAN SPANISH DANCE THEATRE",,,C/O LOTUS MUSIC AND DANCE,,,dcla_culturalinstitutions,6102aac572c49747aa6e3bc7d86a48ed,16,STREET NAME IS MISSING
"ASSOCIATION OF DOMINICAN CLASSICAL ARTISTS, INC.",699,EAST 137 STREET,699 EAST 137 STREET,,,dcla_culturalinstitutions,3b9ac22b7bc44b8e5a25a4f0c93aae39,41,THIS STREET HAS NO ADDRESSES
ASTORIA PERFORMING ARTS CENTER,,,KAUFMAN ASTORIA STUDIOS,,,dcla_culturalinstitutions,db442d55de2dc4de261a2d9f88888f30,16,STREET NAME IS MISSING
"AT HAND THEATRE COMPANY, INC.",214,WEST 122 STREET,214 WEST 122ND STREET,,,dcla_culturalinstitutions,4306d29e3803e6240f81dbe0c802ead3,11,'WEST 122ND STREET' NOT RECOGNIZED. THERE ARE NO SIMILAR NAMES
AZURE ENSEMBLE,,,C/O SUSAN GLASER STEINHARDT SCHOOL NYU,,,dcla_culturalinstitutions,389558c6ec9f3821f8c7bfb8a8e93d24,16,STREET NAME IS MISSING
"BAJA MUSICAL ARTS INITIATIVE, INC.",601,WEST 26 STREET,601 W 26TH ST,,,dcla_culturalinstitutions,65e3e95468acfa6d0bb5cb2283cd7fea,11,'W 26TH ST' NOT RECOGNIZED. THERE ARE NO SIMILAR NAMES
"BALLROOM BASIX USA, INC.",178,EAST 117 STREET,178 E 117TH ST,,,dcla_culturalinstitutions,a295cf1522b20485caaffb52c7d12187,11,'E 117TH ST' NOT RECOGNIZED. THERE ARE NO SIMILAR NAMES
BAM LOCAL DEVELOPMENT CORPORATION,80,HANSEN PLACE,80 HANSEN PLACE,,,dcla_culturalinstitutions,d6ca964f7ebae7f85c480052b1fd6af4,EE,'HANSEN PLACE' NOT RECOGNIZED. THERE ARE 006 SIMILAR NAMES.
"BATTERED WOMEN'S SAFE TERRITORY -AN OPPORTUNITY TO PROGRESS, INC.",94,BENTWOOD DRIVE,94 BENTWOOD DRIVE,,,dcla_culturalinstitutions,3039a80c96bbdcb1def90c7e68788f0c,EE,'BENTWOOD DRIVE' NOT RECOGNIZED. THERE ARE 010 SIMILAR NAMES.
"BIG DANCE THEATER, INC.",303,CLINTON STREET,303 CLINTON STREET,,,dcla_culturalinstitutions,b684a40a9b2dface6738b4a2c21c62cf,42,ADDRESS NUMBER OUT OF RANGE
"BLACK MOON THEATRE COMPANY, INC.",104,GREENPOINT AVENUE,104 GREENPOINT AVENUE,,,dcla_culturalinstitutions,b49a060e13db470242c4cf294255d025,EE,'GREENPOINT AVENUE' NOT RECOGNIZED. THERE ARE 010 SIMILAR NAMES.
BOHEMIAN BENEVOLENT AND LITERARY ASSOCATION OF THE CITY OF NEW YORK,,,BOHEMIAN NATIONAL HALL,,,dcla_culturalinstitutions,fb7f80f3c1d38bbc2671ac117e8436f7,16,STREET NAME IS MISSING
BOUNDLESS THEATRE COMPANY INC.,41-21,42 STREET,41-21 42ND ST,,,dcla_culturalinstitutions,b79d236d05800961b17d1e982b96ab6b,EE,'42ND ST' NOT RECOGNIZED. THERE ARE 002 SIMILAR NAMES.
"BOYS' CLUB OF NEW YORK, INC.",287,10 STREET,287 10TH STREET,,,dcla_culturalinstitutions,03ce09d8522de459abd5e808bd3ed9d1,EE,'10TH STREET' NOT RECOGNIZED. THERE ARE 005 SIMILAR NAMES.
BRECHT FORUM,388,ATLANTIC AVENUE,388 ATLANTIC AVENUE,,,dcla_culturalinstitutions,9e28578b95dc7b2dd5499d64d8943b0a,11,'ATLANTIC AVENUE' NOT RECOGNIZED. THERE ARE NO SIMILAR NAMES
"BRIDGING EDUCATION AND ART TOGETHER, INC.",44-02,23 STREET,44-02 23RD ST,,,dcla_culturalinstitutions,5b5e1de664949c541a05816001c876c2,11,'23RD ST' NOT RECOGNIZED. THERE ARE NO SIMILAR NAMES
BRING TO LIGHT,200,EAST 10 STREET,200 EAST 10TH STREET,,,dcla_culturalinstitutions,cbfecff78cbf27324f79618ccbaceda1,42,ADDRESS NUMBER OUT OF RANGE
"BRONX SYMPHONY ORCHESTRA, INC.",,,C/O DENISE ORR,,,dcla_culturalinstitutions,641e4004ac8c75ed9a956bd86eadf18e,16,STREET NAME IS MISSING
"CATHOLIC CHARITIES COMMUNITY SERVICES, ARCHDIOCESE OF NEW YORK",1011,FIRST AVENUE,1011 FIRST AVENUE,,,dcla_culturalinstitutions,471aad861b8eb3f1efe44060575293c3,13,ADDRESS NBR HAS INVALID FORMAT FOR EDGEWATER PARK
CENTER FOR EDUCATIONAL INNOVATION-PUBLIC EDUCATION ASSOCIATION,28,WEST 44 STREET,28 WEST 44TH STREET,,,dcla_culturalinstitutions,726ab96a95e3d7216f5c3f69c27c712b,11,'WEST 44TH STREET' NOT RECOGNIZED. THERE ARE NO SIMILAR NAMES
CHAMBERS MEMORIAL BAPTIST CHURCH,219,EAST 123 ROAD STREET,219 EAST 123 RD STREET,,,dcla_culturalinstitutions,0cf1a650498eb759e984fbe697b4f4bb,EE,'EAST 123 RD STREET' NOT RECOGNIZED. IS IT 'EAST  123 STREET'?
CHANGE FOR KIDS INC,110,EAST 23 STREET,110 EAST 23RD STREET,,,dcla_culturalinstitutions,110e9070d41ff77396fcbbbe0b857560,11,'EAST 23RD STREET' NOT RECOGNIZED. THERE ARE NO SIMILAR NAMES
CHELSEA MUSIC FESTIVAL,,,C/O ROBERT S PERLSTEIN ESQ,,,dcla_culturalinstitutions,9ac44d93605be63c78567cb1fd9c4308,16,STREET NAME IS MISSING
CHILDREN'S ORCHESTRA SOCIETY,65-03,WEST 180 STREET,65-03 180TH STREET,,,dcla_culturalinstitutions,ae9240bc980d4b6f211b68dfb184746d,42,ADDRESS NUMBER OUT OF RANGE
"CHINESE MUSICAL ARTS, INC.",,,C/O XIAOSHAN WEN,,,dcla_culturalinstitutions,315560eb601732c9048fcecd69a6e3b3,16,STREET NAME IS MISSING
"CIVILIANS, INC.",138,SOUTH OXFORD STREET,138 S OXFORD STREET,,,dcla_culturalinstitutions,25d90163cb98f048ecb0a77c2a38d973,11,'S OXFORD STREET' NOT RECOGNIZED. THERE ARE NO SIMILAR NAMES
"CLASSICAL THEATRE OF HARLEM, INC.",,,C/O WEWORK HARLEM,,,dcla_culturalinstitutions,a166f713ce0493970930af9235e3d01a,16,STREET NAME IS MISSING
"COLLECTED OBJECTS, INC.",100,NEWEL STREET,100 NEWEL STREET,,,dcla_culturalinstitutions,efaee1966b501e34ca83b090dde6af0e,EE,'NEWEL STREET' NOT RECOGNIZED. THERE ARE 010 SIMILAR NAMES.
COMPLEXIONS - A CONCEPT IN DANCE,,,C/O NMBC,,,dcla_culturalinstitutions,2a3ce1dcd0a2e3c5031ab84652c8be97,16,STREET NAME IS MISSING
CONSCIENTIOUS MUSICAL REVUES,2576,BROADWAY,2576 BROADWAY,,,dcla_culturalinstitutions,fe7ebec583e2effe0f8e0e5fe6a1eaf3,42,ADDRESS NUMBER OUT OF RANGE
"CORONA YOUTH MUSIC PROJECT, INC.",155,WEST 68 STREET,155 WEST 68TH STREET,,,dcla_culturalinstitutions,57a4a9e3a47e505b21fedbc9ecf3870f,11,'WEST 68TH STREET' NOT RECOGNIZED. THERE ARE NO SIMILAR NAMES
CULTURAL MUSEUM OF AFRICAN ART - THE ERIC EDWARDS COLLECTION,213,TAAFFE PLACE-SUITE,213 TAAFFE PLACE-SUITE,,,dcla_culturalinstitutions,d7a9ae88b4bc715e08f4e5ce1d8259aa,EE,'TAAFFE PLACE-SUITE' NOT RECOGNIZED. THERE ARE 002 SIMILAR NAMES.
CURRAN EVENTS INC,21,FIRST AVENUE,21 FIRST AVENUE,,,dcla_culturalinstitutions,a7ae94bf7b0e0c83086653c5a6a23a9f,42,ADDRESS NUMBER OUT OF RANGE
"DANCE PARADE, INC.",789,WESTMINSTER ROAD,789 WESTMINSTER ROAD,,,dcla_culturalinstitutions,e51ad6efd64c3a2a7bb7b1a3391616a9,EE,'WESTMINSTER ROAD' NOT RECOGNIZED. THERE ARE 010 SIMILAR NAMES.
"DANCE PROJECT SEQUENCE, INC.",37-18,NORTHERN BOULEVARD,37-18 NORTHERN BLVD,,,dcla_culturalinstitutions,d6be40131a78d8db3e884657f46504cf,EE,'NORTHERN BLVD' NOT RECOGNIZED. THERE ARE 010 SIMILAR NAMES.
"DANCING IN THE STREETS, INC.",555,BERGEN AVENUE,555 BERGEN AVENUE,,,dcla_culturalinstitutions,1c335a9c43135e4831973336f751d471,EE,'BERGEN AVENUE' NOT RECOGNIZED. THERE ARE 010 SIMILAR NAMES.
"DANSPACE PROJECT, INC.",,,ST MARK'S CHURCH,,,dcla_culturalinstitutions,6ee66c140f93852302ceefbcaafa671d,16,STREET NAME IS MISSING
"DECONSTRUCTIVE THEATRE PROJECT, INC.",1421,DEKALB AVENUE,1421 DEKALB AVENUE,,,dcla_culturalinstitutions,6dab71026a2b2096ea6ca46cca9b9eba,EE,'DEKALB AVENUE' NOT RECOGNIZED. THERE ARE 002 SIMILAR NAMES.
DIVAS FOR SOCIAL JUSTICE,131-02,229 STREET,131-02 229TH STREET,,,dcla_culturalinstitutions,139a65015a923982ed6827c4078eb1f0,11,'229TH STREET' NOT RECOGNIZED. THERE ARE NO SIMILAR NAMES
"DOWN TOWN GLEE CLUB, INC.",1494,BOWLING GREEN STATION,POBOX 1494 BOWLING GREEN STATION,,,dcla_culturalinstitutions,a0d4cce55aa111c2c4839e8bc3f018b3,EE,'BOWLING GREEN STATION' NOT RECOGNIZED. THERE ARE 004 SIMILAR NAMES.
DRAMA CLUB INC,34-18,NORTHERN BOULEVARD,34-18 NORTHERN BLVD,,,dcla_culturalinstitutions,969b47037f3e5a6135f14178503785b1,EE,'NORTHERN BLVD' NOT RECOGNIZED. THERE ARE 010 SIMILAR NAMES.
EL MUNDO DEL FLAMENCO NY CENTER FOR FLAMENCO,,,DANCE NEW AMSTERDAM,,,dcla_culturalinstitutions,156257db60291b357fc4722e2cfc0855,16,STREET NAME IS MISSING
"ELEVATOR REPAIR SERVICE THEATER, INC.",47,GREAT JONES STREET,47 GREAT JONES STREET,,,dcla_culturalinstitutions,07f23974bf9816933461b4ae8b729506,EE,'GREAT JONES STREET' NOT RECOGNIZED. THERE ARE 010 SIMILAR NAMES.
"ENCOMPASS THEATRE COMPANY, INC.",138,SOUTH OXFORD STREET,138 SOUTH OXFORD STREET,,,dcla_culturalinstitutions,a6ad20ec12e2909529781cd844f1927d,11,'SOUTH OXFORD STREET' NOT RECOGNIZED. THERE ARE NO SIMILAR NAMES
"ESOPUS FOUNDATION, LTD.",41,SCHERMERHORN STREET,41 SCHERMERHORN ST,,,dcla_culturalinstitutions,66b7228ac713586490259322c2d50df7,EE,'SCHERMERHORN ST' NOT RECOGNIZED. THERE ARE 010 SIMILAR NAMES.
"EX.PGIRL, INC.",366,13 STREET,366 13TH STREET,,,dcla_culturalinstitutions,83ba3586f14be83080e7071b4003ddcb,EE,'13TH STREET' NOT RECOGNIZED. THERE ARE 004 SIMILAR NAMES.
FGP NYC INC,60-84,70 AVENUE,60-84 70TH AVE,,,dcla_culturalinstitutions,0a0e9ddb51d9de98478a2c7777acd5ba,EE,'70TH AVE' NOT RECOGNIZED. THERE ARE 005 SIMILAR NAMES.
"FICTION, INC.",,,DEPT OF ENGL NAC 6TH FLOOR CITY COLLEGE OF NEW YORK,,,dcla_culturalinstitutions,276c8a07213b1ea7c9bc9ba085b1d19e,16,STREET NAME IS MISSING
"FIVE BOROUGHS MUSIC FESTIVAL, INC.",759,PRESIDENT STREET,759 PRESIDENT ST,,,dcla_culturalinstitutions,b9213a86af63eadbc01b6a51c4d1e756,EE,'PRESIDENT ST' NOT RECOGNIZED. THERE ARE 010 SIMILAR NAMES.
"FIVE MYLES, INC.",133,WOOSTER STREET,133 WOOSTER STREET,,,dcla_culturalinstitutions,17c3ba080dd0c64245bb55a0805fd8e0,EE,'WOOSTER STREET' NOT RECOGNIZED. THERE ARE 010 SIMILAR NAMES.
"FLAMENCO LATINO, INC.",84-12,35 AVENUE,84-12 35TH AVENUE,,,dcla_culturalinstitutions,f5fd5695d23a7933f48ef10dc4f1644a,EE,'35TH AVENUE' NOT RECOGNIZED. THERE ARE 002 SIMILAR NAMES.
FLEADH FOUNDATION,,,C/O 13 DESIGNS STUDIO,,,dcla_culturalinstitutions,48e521930b7ab222fce8d2b328ee1c14,16,STREET NAME IS MISSING
"FLUX THEATRE ENSEMBLE, INC.",6776,BOOTH STREET,6776 BOOTH STREET,,,dcla_culturalinstitutions,91bdb8be912f8877dc89705830df1b0b,EE,'BOOTH STREET' NOT RECOGNIZED. IS IT 'BOOKER T WASHINGTON PG'?
"FRACTURED ATLAS PRODUCTIONS, INC.",232,3 STREET,232 3RD STREET,,,dcla_culturalinstitutions,fe5e9cee52e9c6ff54cd289758557349,EE,'3RD STREET' NOT RECOGNIZED. THERE ARE 010 SIMILAR NAMES.
"FREE103POINT9, INC.",5662,ROUTE 23,5662 ROUTE 23,,,dcla_culturalinstitutions,1216dac0c76f04f1b9b9a41ace929c50,EE,'ROUTE 23' NOT RECOGNIZED. IS IT 'ROUTE    1'?
"FRESH ART, INC.",,,C/O ST MARGARET'S HOUSE,,,dcla_culturalinstitutions,efd339b75c2261f8e23f71ef51860f72,16,STREET NAME IS MISSING
"FRESHSTART-CULTURAL THEATRE ARTS PRODUCTIONS, INC.",10,RICHMAN PLAZA,10 RICHMAN PLAZA,,,dcla_culturalinstitutions,f33959974d9fea5ba99950336424ab4c,EE,'RICHMAN PLAZA' NOT RECOGNIZED. THERE ARE 005 SIMILAR NAMES.
"FRIENDS OF THE CHORAL SOCIETY, INC.",,,C/O JOHN MACLAY,,,dcla_culturalinstitutions,c2c779232a8b5fd437d4e3fdb2bb05be,16,STREET NAME IS MISSING
GELSEY KIRKLAND ACADEMY OF CLASSICAL BALLET,,,GELSEY KIRKLAND ACADEMY OF CLASSICAL BALLET,,,dcla_culturalinstitutions,13543bcc0486cfe4f9714e7e2d9fa319,16,STREET NAME IS MISSING
"GUERRILLA SHAKESPEARE PROJECT, INC.",237,9 STREET,237 9TH STREET,,,dcla_culturalinstitutions,5770323d243864e785a658f7fe14672c,EE,'9TH STREET' NOT RECOGNIZED. THERE ARE 004 SIMILAR NAMES.
"HAITI CULTURAL EXCHANGE, INC.",,,C/O FIVE MYLES GALLERY,,,dcla_culturalinstitutions,e65abb48fdae6c076038c7557fdeda75,16,STREET NAME IS MISSING
"HARLEM PRESENTS, INC.",114-73,WEST 178 STREET,114-73 178TH STREET,,,dcla_culturalinstitutions,95ccb02bf76eacc75dcf42154990d0df,42,ADDRESS NUMBER OUT OF RANGE
HARLEM-HEIGHTS CULTURAL COUNCIL INC.,,,AUDUBON CENTER COLUMBIA UNIVERSITY,,,dcla_culturalinstitutions,0c85a85f58fa8881287df0b5ed9fa26c,16,STREET NAME IS MISSING
"HARLEM9, INC.",1855,ADAM CLAYTON POWEL JR BOULEVARD,1855 ADAM CLAYTON POWEL JR BLVD,,,dcla_culturalinstitutions,27fefdbf60d758ebd2fd98002036ec25,EE,'ADAM CLAYTON POWEL JR BLVD' NOT RECOGNIZED. THERE ARE 002 SIMILAR NAMES.
"HELL'S KITCHEN, NY CHAPTER OF SPEBSQSA, INC.",,,VOICES OF GOTHAM BARBERSHOP CHORUS,,,dcla_culturalinstitutions,f08c572ec89e80c49b1a2fea6a2958c8,16,STREET NAME IS MISSING
"HUMBLE ARTS FOUNDATION, INC.",,,POB 1157,,,dcla_culturalinstitutions,29e79c9a9ddd66d8a0ac4b81f577c7ec,16,STREET NAME IS MISSING
HUNGARIAN THEATRE & ART ASSOCIATION INC.,32-22,91 STREET,32-22 91 ST,,,dcla_culturalinstitutions,23f01f26ae3c9b03c78ffa4b7c7dedec,EE,'91 ST' NOT RECOGNIZED. THERE ARE 002 SIMILAR NAMES.
"IL PICCOLO TEATRO DELL'OPERA, INC.",41,SCHERMERHORN STREET,41 SCHERMERHORN STREET,,,dcla_culturalinstitutions,6d631caf5c71737f42af68b7e97cf148,EE,'SCHERMERHORN STREET' NOT RECOGNIZED. THERE ARE 010 SIMILAR NAMES.
IMAGINE PROJECT INC,540,OCEAN PARKWAY,540 OCEAN PARKWAY,,,dcla_culturalinstitutions,0b2ce062afe22886db28018f1a9a244a,11,'OCEAN PARKWAY' NOT RECOGNIZED. THERE ARE NO SIMILAR NAMES
IMAGINE SCIENCE FILMS,,,NEW LAB BUILDING 128,,,dcla_culturalinstitutions,60e2d246a7e4031fe3d7e0345e3370f4,16,STREET NAME IS MISSING
"IMMIGRANTS' THEATRE PROJECT, INC.",44,DOUGLASS STREET,44 DOUGLASS STREET,,,dcla_culturalinstitutions,5b67ebd256bb4f698f9c99618d527f08,EE,'DOUGLASS STREET' NOT RECOGNIZED. THERE ARE 010 SIMILAR NAMES.
"INDEPENDENT MEDIA ARTS PRESERVATION, INC.",,,C/O EAI,,,dcla_culturalinstitutions,85610962cc11b09800c25423f879683b,16,STREET NAME IS MISSING
INDYKIDS,,,INDYKIDS,,,dcla_culturalinstitutions,7ee16e73e2b445bfa9b76a8da1752f67,16,STREET NAME IS MISSING
INSTITUTE FOR PUBLIC ARCHITECTURE,45,EAST 20 STREET,45 E 20TH STREET,,,dcla_culturalinstitutions,6f8c05ce08fe4f737fa3b1a5c462c389,EE,'E 20TH STREET' NOT RECOGNIZED. IS IT 'EAST   20 ROAD'?
"INTERNATIONAL AGENCY FOR MINORITY ARTISTS AFFAIRS, INC.",,,ADAM CLAYTON POWELL JR STATE OFFICE BUILDING,,,dcla_culturalinstitutions,a2d3b7485b7b9d11ebda316a303a2835,16,STREET NAME IS MISSING
"INTERNATIONAL ARTS MOVEMENT, INC.",,,,,,dcla_culturalinstitutions,564583b3cc41e4e3607c114c659f5b10,16,STREET NAME IS MISSING
"INTREPID MUSEUM FOUNDATION, INC.",1,INTREPID SQUARE,ONE INTREPID SQUARE,,,dcla_culturalinstitutions,94b8424396a99d0119bda2c35ab4c540,EE,'INTREPID SQUARE' NOT RECOGNIZED. THERE ARE 010 SIMILAR NAMES.
"JACK ARTS, INC.",,,C/O ALEC DUFFY,,,dcla_culturalinstitutions,ec068f64adc958b758ba584e6fb83d6f,16,STREET NAME IS MISSING
JACKIE ROBINSON PARK CONSERVANCY,,,POBOX 1194,,,dcla_culturalinstitutions,99b1fb0f597378f8e2e40fa4e056f24b,16,STREET NAME IS MISSING
"KOREAN AMERICAN HERITAGE FOUNDATION, INC.",163-07,DEPOT ROAD,163-07 DEPOT ROAD,,,dcla_culturalinstitutions,811a3f2ae01ef356a2a56b3b7a1b0112,EE,'DEPOT ROAD' NOT RECOGNIZED. THERE ARE 005 SIMILAR NAMES.
KOREAN ART FORUM,616,WEST 207 STREET,616 WEST 207TH STREET,,,dcla_culturalinstitutions,e4a681c3eda872d85e7372a5a12f4d05,11,'WEST 207TH STREET' NOT RECOGNIZED. THERE ARE NO SIMILAR NAMES
"KYO-SHIN-AN ARTS, INC.",44,PROSPECT PARK WEST,44 PROSPECT PARK WEST,,,dcla_culturalinstitutions,0a7fac7ea8aeaa2d24f4c00840cceb12,EE,'PROSPECT PARK WEST' NOT RECOGNIZED. IS IT 'PROSPECT PLACE'?
"LAUNDROMAT PROJECT, INC.",127,WEST 127 STREET,127 WEST 127TH STREET,,,dcla_culturalinstitutions,2edf581282b465ef68b67bf32817f308,11,'WEST 127TH STREET' NOT RECOGNIZED. THERE ARE NO SIMILAR NAMES
"LEGROS CULTURAL ARTS, INC.",146,WEST 225 STREET,146-28 225 STREET,,10463,dcla_culturalinstitutions,ba45a84b8013d74a8f9073258ffd7dee,01,ADDR NUMBER ALTERED: RANGE ASSUMED. USING DIGITS BEFORE DASH ONLY
"LES BALLETS TROCKADERO DE MONTE CARLO, INC.",,,BOX 1325 GRACIE STATION,,,dcla_culturalinstitutions,7fc5dbb4dec1488936be9456056d32b0,16,STREET NAME IS MISSING
"LIBERATED MOVEMENT, INC.",87-09,34 AVENUE,87-09 34TH AVE,,,dcla_culturalinstitutions,c1c9db10f2619c55824672ab8b21126e,EE,'34TH AVE' NOT RECOGNIZED. THERE ARE 005 SIMILAR NAMES.
"LIGHT OPERA OF NEW YORK, INC.",,,LIGHT OPERA OF NEW YORK,,,dcla_culturalinstitutions,45fe7e034c2674230ff1835aaba4c6bc,16,STREET NAME IS MISSING
"LOISAIDA, INC.",300,EAST 175 STREET,300 E 175TH STREET,,,dcla_culturalinstitutions,0d2b6e7119774ef893a651630bc35b8e,11,'E 175TH STREET' NOT RECOGNIZED. THERE ARE NO SIMILAR NAMES
"MABOU MINES DEVELOPMENT FOUNDATION, INC.",,,PETER STUYVESANT STATION,,,dcla_culturalinstitutions,518b8c74a2a71cc20ae1ece0faee6a3a,16,STREET NAME IS MISSING
MAN UP! INC.,,VAN SICLEN AVENUE,797/799 VAN SICLEN AVENUE,,,dcla_culturalinstitutions,3b29c6e65bbfc5d28eda34a428925a98,13,ADDRESS NBR 797/799  CONTAINS AN INVALID CHARACTER(/) IN POSITION 4.
MANO A MANO: MEXICAN CULTURE WITHOUT BORDERS,126,ST FELIX STREET,126 ST FELIX STREET,,,dcla_culturalinstitutions,aecec5346010c9f0285cc9d47e257dc4,EE,'ST FELIX STREET' NOT RECOGNIZED. THERE ARE 010 SIMILAR NAMES.
MESSENGER THEATRE CORP,617,WEST 190 STREET,617 W 190TH ST,,,dcla_culturalinstitutions,05b34f7e14df0a4db3f992e3dc56716f,11,'W 190TH ST' NOT RECOGNIZED. THERE ARE NO SIMILAR NAMES
"METROPOLIS ENSEMBLE, INC.",34-33,84 STREET,34-33 84TH STREET,,,dcla_culturalinstitutions,e937e746e3ad8a566a39d1596d6dc2c2,EE,'84TH STREET' NOT RECOGNIZED. THERE ARE 003 SIMILAR NAMES.
"MIGRATING FORMS FESTIVAL, INC",,,COOPER STATION,,,dcla_culturalinstitutions,8f188fea5a6061b0e90613a5e212edb3,16,STREET NAME IS MISSING
"MOTHERHOOD FOUNDATION, INC.",401,EAST 84,401 E 84TH,,,dcla_culturalinstitutions,d25853ab69e10ba31f7d857ce1fa356d,EE,'E 84TH' NOT RECOGNIZED. THERE ARE 002 SIMILAR NAMES.
MUSEUM FOR AFRICAN ART,1280,FIFTH AVENUE,1280 FIFTH AVENUE,,,dcla_culturalinstitutions,71514bc7feb2d0229714bc18848deb16,42,ADDRESS NUMBER OUT OF RANGE
MUSIC FORWARD,72,ORANGE STREET,72 ORANGE STREET,,,dcla_culturalinstitutions,cdc63621eb8135405d51086332d29cd4,11,'ORANGE STREET' NOT RECOGNIZED. THERE ARE NO SIMILAR NAMES
"NATIONAL BOOK FOUNDATION, INC.",90,BROAD STREET,90 BROAD STREET,,,dcla_culturalinstitutions,2cb1f42f89be4cf42946447c5d546352,EE,'BROAD STREET' NOT RECOGNIZED. THERE ARE 010 SIMILAR NAMES.
NATIONAL LIGHTHOUSE MUSEUM,200,PROMENADE AT LIGHTHOUSE POINT,200 PROMENADE AT LIGHTHOUSE POINT,,,dcla_culturalinstitutions,75f6ca5f8056234fcd9dc166ba47fc5d,EE,'PROMENADE AT LIGHTHOUSE POINT' NOT RECOGNIZED. THERE ARE 008 SIMILAR NAMES.
NAVATMAN,76-18,266 STREET,76-18 266TH STREET,,,dcla_culturalinstitutions,d4c80bc5e7fab5baaac7d6110af74506,11,'266TH STREET' NOT RECOGNIZED. THERE ARE NO SIMILAR NAMES
"NEW FESTIVAL, INC.",601,WEST 26 STREET,601 WEST 26TH STREET,,,dcla_culturalinstitutions,d2eaa3829766f1559e412f585787b287,11,'WEST 26TH STREET' NOT RECOGNIZED. THERE ARE NO SIMILAR NAMES
NEW YORK CLASSICAL PLAYERS,101,LAFAYETTE AVENUE,101 LAFAYETTE AVENUE,,,dcla_culturalinstitutions,e8ce68c361d0dae1acb9c4e7518f7874,EE,'LAFAYETTE AVENUE' NOT RECOGNIZED. THERE ARE 005 SIMILAR NAMES.
"NEW YORK COMPOSERS CIRCLE, INC.",252,DEKALB AVENUE,252 DEKALB AVENUE,,,dcla_culturalinstitutions,b3fee629af0173728c902fe7dcdf061a,EE,'DEKALB AVENUE' NOT RECOGNIZED. THERE ARE 002 SIMILAR NAMES.
NEW YORK COUNCIL FOR THE HUMANITIES,150,BROADWAY,150 BROADWAY,,,dcla_culturalinstitutions,d10b5ca5aa7e8bb39e49fc323d84b9b1,42,ADDRESS NUMBER OUT OF RANGE
"NEW YORK NEW MUSIC ENSEMBLE, INC.",43,MACE STREET,43 MACE STREET,,,dcla_culturalinstitutions,1cc5cdd07dd203590e142ab9eac70746,EE,'MACE STREET' NOT RECOGNIZED. THERE ARE 010 SIMILAR NAMES.
"NO LONGER EMPTY, INC.",122,WEST 27 STREET,122 WEST 27TH STREET,,,dcla_culturalinstitutions,90bb007a7f45d0e7d48d4e2bfc2c391c,11,'WEST 27TH STREET' NOT RECOGNIZED. THERE ARE NO SIMILAR NAMES
NORTHERN MANHATTAN ARTS ALLIANCE,,,WORKSPACE,,,dcla_culturalinstitutions,389892ac9dadfc500cfaa89f60b40087,16,STREET NAME IS MISSING
"NUIT BLANCHE NEW YORK, LLC",200,EAST 10 STREET,200 EAST 10TH ST,,,dcla_culturalinstitutions,09265573ab2332223d657328949a5d71,42,ADDRESS NUMBER OUT OF RANGE
"NW&D, INC.",,,C/O THE FIELD,,,dcla_culturalinstitutions,12c6964d3a7bcbfeb0dbdc3624e36b29,16,STREET NAME IS MISSING
"ONE YEAR LEASE, INC.",138,SOUTH OXFORD STREET,138 SOUTH OXFORD STREET,,,dcla_culturalinstitutions,d1545e57d0d392c389cdb960b2c0391a,11,'SOUTH OXFORD STREET' NOT RECOGNIZED. THERE ARE NO SIMILAR NAMES
OPERA COMPANY OF BROOKLYN ASSOCIATION,,,BRENDAN MOFFITT,,,dcla_culturalinstitutions,55b0fbe2997864e6e229999b8f0f7282,16,STREET NAME IS MISSING
OTHERS ARE US,121,WEST 72 STREET,121 WEST 72ND STREET,,,dcla_culturalinstitutions,59807da2b562beec344b1bddbbc11f86,11,'WEST 72ND STREET' NOT RECOGNIZED. THERE ARE NO SIMILAR NAMES
"PARALLEL EXIT, INC.",175,EASTERN PARKWAY,175 EASTERN PARKWAY,,,dcla_culturalinstitutions,c521c5edd0ff66d2477e0b0633ecbcb8,EE,'EASTERN PARKWAY' NOT RECOGNIZED. THERE ARE 010 SIMILAR NAMES.
PARTIAL COMFORT PRODUCTIONS,26,TOMPKINS PLACE,26 TOMPKINS PLACE,,,dcla_culturalinstitutions,b1f00ec9efff11c9ca6287522abab2b9,EE,'TOMPKINS PLACE' NOT RECOGNIZED. THERE ARE 006 SIMILAR NAMES.
PDM PERFORMING ARTS CORPORATION,219-26,138 ROAD,219-26 138 ROAD,,,dcla_culturalinstitutions,0c43cafbc1ae752fe958649e33e9a075,11,'138 ROAD' NOT RECOGNIZED. THERE ARE NO SIMILAR NAMES
"PECCADILLO THEATER COMPANY, INC.",,,THEATRE AT ST CLEMENT'S,,,dcla_culturalinstitutions,1dbefb60135e8d5b62548dc981b52149,16,STREET NAME IS MISSING
PEOPLE'S URBAN FILMS PUF FOUNDATION INC.,102,DIWIGHT STREET,102 DIWIGHT STREET,,,dcla_culturalinstitutions,b35a474e1926f322aafb167a207ada7e,11,'DIWIGHT STREET' NOT RECOGNIZED. THERE ARE NO SIMILAR NAMES
