facname,addressnum,streetname,address,boro,zipcode,datasource,uid,grc,message
BRONXWORKS INC HARM REDUCTION SERVICES,85,BURNSIDE AVENUE,85 BURNSIDE AVENUE,,,moeo_socialservicesiteloactions,906c1bbd366992b89a37737fd85d6900,EE,'BURNSIDE AVENUE' NOT RECOGNIZED. THERE ARE 007 SIMILAR NAMES.
BROOKDALE UNIVERSITY HOSPITAL AND MEDICAL CENTER CPEP CRISIS OUTREACH,,,NO ADDRESS,,,moeo_socialservicesiteloactions,ba2be5b3d6003f2614d46a0b45905007,16,STREET NAME IS MISSING
BROOKLYN COMMUNITY SERVICES/BROOKLYN BUREAU OF COMMUNITY SERVICE PREVENTIVE SERVICES,1491,BROADWAY STREET,1491 BROADWAY STREET,,,moeo_socialservicesiteloactions,f854b57a9e257fd6c453b6d0d2624b12,EE,'BROADWAY STREET' NOT RECOGNIZED. THERE ARE 010 SIMILAR NAMES.
CAMBA INC NY NY III SUPPORTED HOUSING,,,NO ADDRESS,,,moeo_socialservicesiteloactions,af3f0ea46d95f841f2e2c2935b077fdd,16,STREET NAME IS MISSING
CAMBA INC PREVENTIVE SERVICES,444,THOMAS BOYLAND AVENUE,444 THOMAS BOYLAND AVENUE,,,moeo_socialservicesiteloactions,c0ea07553bd07a56b9ea61bf0dd8bbb0,EE,'THOMAS BOYLAND AVENUE' NOT RECOGNIZED. THERE ARE 009 SIMILAR NAMES.
CAMBA INC SUPPORTED HOUSING,,,NO ADDRESS,,,moeo_socialservicesiteloactions,9d1a8bb87eaa6e53143eecc024c7c1a2,16,STREET NAME IS MISSING
CARE FOR THE HOMELESS HIV TESTING SERVICES: PRIORITY POPULATIONS TESTING IN NON-CLINICAL SETTINGS,,JEROME AVENUE,19-11-21 JEROME AVENUE,,,moeo_socialservicesiteloactions,50d99f0fe0d2ad1fc7417f0f3340ac00,13,ADDRESS NBR 19-11-21  HAS TOO MANY DASHES.
CARE FOR THE HOMELESS HIV TESTING SERVICES: PRIORITY POPULATIONS TESTING IN NON-CLINICAL SETTINGS,1143,ANDREWS AVENUE,1143 ANDREWS AVENUE,,,moeo_socialservicesiteloactions,0cf3fd5ad6824383aa4b78487ecac3d2,42,ADDRESS NUMBER OUT OF RANGE
CATHOLIC CHARITIES NEIGHBORHOOD SERVICES INC HOMEBASE HOMELESSNESS PREVENTION,,,NO ADDRESS,,,moeo_socialservicesiteloactions,96d0a07073d14d9419a09ed80b93d144,16,STREET NAME IS MISSING
CATHOLIC CHARITIES NEIGHBORHOOD SERVICES INC NON-MEDICAID CARE COORDINATION (OMH),,,NO ADDRESS,,,moeo_socialservicesiteloactions,223b5fda40f00acbe5f159bbfd92018e,16,STREET NAME IS MISSING
CATHOLIC CHARITIES NEIGHBORHOOD SERVICES INC OUTREACH,,,NO ADDRESS,,,moeo_socialservicesiteloactions,8697ec9f6e4bd39f874e1b2bc48ed268,16,STREET NAME IS MISSING
CATHOLIC CHARITIES NEIGHBORHOOD SERVICES INC SUPPORTED HOUSING,,,NO ADDRESS,,,moeo_socialservicesiteloactions,5ef37c3fa0764ea0c530d5075565d6a9,16,STREET NAME IS MISSING
CATHOLIC GUARDIAN SERVICES / FORMERLY CATHOLIC GUARDIAN SOCIETY AND HOME BUREAU FOSTER CARE,3356,FORT INDEPENDENCE AVENUE,3356 FORT INDEPENDENCE AVENUE,,,moeo_socialservicesiteloactions,dfa720b3ad67ace407cbb5b43ca314b6,EE,'FORT INDEPENDENCE AVENUE' NOT RECOGNIZED. THERE ARE 010 SIMILAR NAMES.
CENTER FOR ALTERNATIVE SENTENCING EMPLOYMENT SERVICES INC ASSERTIVE COMMUNITY TREATMENT,,,NO ADDRESS,,,moeo_socialservicesiteloactions,7c5b0f234d04180dbaa8280793e2e151,16,STREET NAME IS MISSING
CENTER FOR URBAN COMMUNITY SERVICES INC ASSERTIVE COMMUNITY TREATMENT,,,NO ADDRESS,,,moeo_socialservicesiteloactions,bd944fc571af2873861a8e85327c8415,16,STREET NAME IS MISSING
CENTER FOR URBAN COMMUNITY SERVICES INC OUTREACH,,,NO ADDRESS,,,moeo_socialservicesiteloactions,705d3a86d2ca8077ae6e4f852b78e34d,16,STREET NAME IS MISSING
COMMUNITY ACCESS INC RECOVERY CENTER,,,NO ADDRESS,,,moeo_socialservicesiteloactions,a6642564e5e964d5d24605830c6a5b1c,16,STREET NAME IS MISSING
COMMUNITY ASSOCIATION OF PROGRESSIVE DOMINICANS INC SCHOOL,,,NO ADDRESS,,,moeo_socialservicesiteloactions,f3bb2560be8aae4d9b85731b531a812e,16,STREET NAME IS MISSING
COMMUNITY HEALTH PROJECT INC REPRODUCTIVE AND SEXUAL HEALTH SERVICES,,,NO ADDRESS,,,moeo_socialservicesiteloactions,d7f17ed9b0afb5034eac2ef86ac0faae,16,STREET NAME IS MISSING
COMMUNITY HEALTHCARE NETWORK INC HIV TESTING SERVICES: SOCIAL NETWORK STRATEGY TESTING IN NON-CLINICAL SETTINGS,,,NO ADDRESS,,,moeo_socialservicesiteloactions,cc8b27daaae29950ef2a1731f3fea8b7,16,STREET NAME IS MISSING
EPISCOPAL HEALTH SERVICES INC HOME BASED CRISIS INTERVENTION,,,NO ADDRESS,,,moeo_socialservicesiteloactions,cfe7b0a5dacfdb203f6b9545664c7750,16,STREET NAME IS MISSING
FEDERATION OF ORGANIZATIONS FOR THE NEW YORK STATE MENTALLY DISABLED INC ASSERTIVE COMMUNITY TREATMENT,,,NO ADDRESS,,,moeo_socialservicesiteloactions,392924476243b1d86b03242a72a7177f,16,STREET NAME IS MISSING
FEDERATION OF ORGANIZATIONS FOR THE NEW YORK STATE MENTALLY DISABLED INC NON-MEDICAID CARE COORDINATION (OMH),,,NO ADDRESS,,,moeo_socialservicesiteloactions,9e7fb63bc416d8b42c9ee3626a01c85e,16,STREET NAME IS MISSING
FEDERATION OF ORGANIZATIONS FOR THE NEW YORK STATE MENTALLY DISABLED INC SELF-HELP,,,NO ADDRESS,,,moeo_socialservicesiteloactions,7aa88a93408164a37f211ad0f6eeef4c,16,STREET NAME IS MISSING
GAY MEN'S HEALTH CRISIS INC HARM REDUCTION SERVICES,,,NO ADDRESS,,,moeo_socialservicesiteloactions,93014968c81463d4ba329187593ab26c,16,STREET NAME IS MISSING
GEEL COMMUNITY SERVICES INC SUPPORTED HOUSING,,,NO ADDRESS,,,moeo_socialservicesiteloactions,e8bb7aef00301f0b444cadf760c754ff,16,STREET NAME IS MISSING
GODDARD RIVERSIDE COMMUNITY CENTER ASSERTIVE COMMUNITY TREATMENT,,,NO ADDRESS,,,moeo_socialservicesiteloactions,411c1a787d0f67959e96d0bfbf1aac57,16,STREET NAME IS MISSING
GOOD SHEPHERD SERVICES PREVENTIVE SERVICES,503,5 AVENUE,503 5 AVENUE,,,moeo_socialservicesiteloactions,b29b6b109163b5aa852637302424c9d2,13,ADDRESS NBR HAS INVALID FORMAT FOR EDGEWATER PARK
GOOD SHEPHERD SERVICES PREVENTIVE SERVICES,173,CONOVER STREET,173 CONOVER STREET,,,moeo_socialservicesiteloactions,6bad914ecba533f9d588f3ee842811b1,EE,'CONOVER STREET' NOT RECOGNIZED. THERE ARE 010 SIMILAR NAMES.
GOOD SHEPHERD SERVICES PREVENTIVE SERVICES,441,4 AVENUE,441 4 AVENUE,,,moeo_socialservicesiteloactions,8479c9401a4467bdcd54bc1204e7016f,42,ADDRESS NUMBER OUT OF RANGE
GOTHAM PER DIEM INC EARLY INTERVENTION RESPITE CARE - DEVELOPMENTAL DISABILITIES,,,NO ADDRESS,,,moeo_socialservicesiteloactions,7f4aa8ae2d0bb1697f77c69647c824b0,98,NO INPUT DATA RECEIVED
GRAHAM WINDHAM FOSTER CARE,,,,,,moeo_socialservicesiteloactions,7f0b81a92d65ec268af4514a58a18442,16,STREET NAME IS MISSING
HARLEM UNITED: COMMUNITY AIDS CENTER INC COMMUNITY-LEVEL INTERVENTIONS FOR HIV PREVENTION,,,NO ADDRESS,,,moeo_socialservicesiteloactions,613ee43e7f16f3f4dc2cd114ce6f0057,16,STREET NAME IS MISSING
HARLEM UNITED: COMMUNITY AIDS CENTER INC FOOD AND NUTRITION,,,NO ADDRESS,,,moeo_socialservicesiteloactions,0f6df3f2deee7ef6101dd32096bee797,16,STREET NAME IS MISSING
HARLEM UNITED: COMMUNITY AIDS CENTER INC HIV TESTING SERVICES: SOCIAL NETWORK STRATEGY TESTING IN NON-CLINICAL SETTINGS,197,DAVIDSON AVENUE,197 DAVIDSON AVENUE,,,moeo_socialservicesiteloactions,4b36b12c0f2fc6031fbf100aebf94acb,42,ADDRESS NUMBER OUT OF RANGE
HARLEM UNITED: COMMUNITY AIDS CENTER INC HIV TESTING SERVICES: SOCIAL NETWORK STRATEGY TESTING IN NON-CLINICAL SETTINGS,,,NO ADDRESS,,,moeo_socialservicesiteloactions,7e631d2d33c0428d310b2999ce90aed9,16,STREET NAME IS MISSING
HARLEM UNITED: COMMUNITY AIDS CENTER INC NON-MEDICAL CASE MANAGEMENT GENERAL,,,NO ADDRESS,,,moeo_socialservicesiteloactions,43ef1cfb47833bd2c54580373a192759,16,STREET NAME IS MISSING
HARLEM UNITED: COMMUNITY AIDS CENTER INC OUTREACH TO HOMELESS YOUTH,197,DAVIDSON AVENUE,197 DAVIDSON AVENUE,,,moeo_socialservicesiteloactions,855823b3a5af35a24910756ab840da21,42,ADDRESS NUMBER OUT OF RANGE
HARLEM UNITED: COMMUNITY AIDS CENTER INC OUTREACH TO HOMELESS YOUTH,,,NO ADDRESS,,,moeo_socialservicesiteloactions,963f6e43de5c20c528469dc81892d5ef,16,STREET NAME IS MISSING
HARLEM UNITED: COMMUNITY AIDS CENTER INC SUPPORTIVE COUNSELING & FAMILY STABILIZATION SERVICES - SEP,,,NO ADDRESS,,,moeo_socialservicesiteloactions,1ddc9887ba4a873885638b5691cd01d2,16,STREET NAME IS MISSING
HARLEM UNITED: COMMUNITY AIDS CENTER INC UNDETECTABLES VIRAL LOAD SUPPRESSION PROGRAM,,,NO ADDRESS,,,moeo_socialservicesiteloactions,3a8977bda70e9cbafd0f6510ecd34b9f,16,STREET NAME IS MISSING
HARLEM UNITED: COMMUNITY AIDS CENTER INC UNDETECTABLES VIRAL LOAD SUPPRESSION PROGRAM,691,PROSEPCT PLACE,691 PROSEPCT PLACE,,,moeo_socialservicesiteloactions,6ed3331a674b515f51cdbef8e92e3e77,EE,'PROSEPCT PLACE' NOT RECOGNIZED. THERE ARE 010 SIMILAR NAMES.
HEARTSHARE / ST VINCENT'S SERVICES INC FOSTER CARE,12,STEUBEN STREET,12 STEUBEN STREET,,,moeo_socialservicesiteloactions,111243cbf91e7e5a18424b74a9628f26,EE,'STEUBEN STREET' NOT RECOGNIZED. THERE ARE 010 SIMILAR NAMES.
HEARTSHARE / ST VINCENT'S SERVICES INC PREVENTIVE SERVICES,89-31,161ST,89-31 161ST,,,moeo_socialservicesiteloactions,f641466648662e83ec269c44b71467bf,EE,'161ST' NOT RECOGNIZED. THERE ARE 005 SIMILAR NAMES.
HHC NORTH CENTRAL BRONX HOSPITAL HARM REDUCTION SERVICES,,,NO ADDRESS,,,moeo_socialservicesiteloactions,7909760de99331cdcadf325dbffe3547,16,STREET NAME IS MISSING
HISPANIC AIDS FORUM INC HIV TESTING SERVICES: PRIORITY POPULATIONS TESTING IN NON-CLINICAL SETTINGS,,,NO ADDRESS,,,moeo_socialservicesiteloactions,3899340435af4732a9f30d683f80dc71,16,STREET NAME IS MISSING
HISPANIC AIDS FORUM INC HIV TESTING SERVICES: PRIORITY POPULATIONS TESTING IN NON-CLINICAL SETTINGS,76-11,37 STREET,76-11 37 STREET,,,moeo_socialservicesiteloactions,440c63523df762976510c92b3ec9d934,42,ADDRESS NUMBER OUT OF RANGE
HOUSING WORKS INC HIV TESTING SERVICES: SOCIAL NETWORK STRATEGY TESTING IN NON-CLINICAL SETTINGS,,,NO ADDRESS,,,moeo_socialservicesiteloactions,55e7cda3253010a6c6985e3a22abc198,16,STREET NAME IS MISSING
HOUSING WORKS INC OUTREACH TO HOMELESS YOUTH,,,NO ADDRESS,,,moeo_socialservicesiteloactions,45e3f1ff3f67b36146860b3eed6af15c,16,STREET NAME IS MISSING
INSTITUTE FOR COMMUNITY LIVING INC ASSERTIVE COMMUNITY TREATMENT,,,NO ADDRESS,,,moeo_socialservicesiteloactions,7eecec27d18ad9dd298fba0cf4c8470e,16,STREET NAME IS MISSING
INSTITUTE FOR COMMUNITY LIVING INC NON-MEDICAID CARE COORDINATION (OMH),,,NO ADDRESS,,,moeo_socialservicesiteloactions,5308005f3a6d321a2ba33423bbb91286,16,STREET NAME IS MISSING
INSTITUTE FOR COMMUNITY LIVING INC NON-MEDICAID CARE COORDINATION; (NON-LICENSED PROGRAM),,,NO ADDRESS,,,moeo_socialservicesiteloactions,5fa05c95ac9ecc9525662a7ac45d85c4,16,STREET NAME IS MISSING
INSTITUTE FOR COMMUNITY LIVING INC NY NY III SUPPORTED HOUSING,,,NO ADDRESS,,,moeo_socialservicesiteloactions,7910bb82d54b4a506a680583cee83f99,16,STREET NAME IS MISSING
INSTITUTE FOR COMMUNITY LIVING INC SUPPORTED HOUSING,,,NO ADDRESS,,,moeo_socialservicesiteloactions,bbd1173793443b73b29aa05ea0c7e6f0,16,STREET NAME IS MISSING
INTERBOROUGH DEVELOPMENTAL AND CONSULTATION CENTER INC SCHOOL,,,NO ADDRESS,,,moeo_socialservicesiteloactions,86e3079ef6a3cd32ead2c769f884717d,16,STREET NAME IS MISSING
IRIS HOUSE: A CENTER FOR WOMEN LIVING WITH HIV INC HIV TESTING SERVICES: SOCIAL NETWORK STRATEGY TESTING IN NON-CLINICAL SETTINGS,,,NO ADDRESS,,,moeo_socialservicesiteloactions,8083f3668095ce934315a7fb7eb9a2e8,16,STREET NAME IS MISSING
JEWISH BOARD OF FAMILY AND CHILDREN'S SERVICES INC HOME BASED CRISIS INTERVENTION,,,NO ADDRESS,,,moeo_socialservicesiteloactions,74c0745934f7574e2e7b169e06ecde79,16,STREET NAME IS MISSING
JEWISH BOARD OF FAMILY AND CHILDREN'S SERVICES INC NON-MEDICAID CARE COORDINATION (OMH),,,NO ADDRESS,,,moeo_socialservicesiteloactions,bf50b1cae0794cc3d5be893c497837b6,16,STREET NAME IS MISSING
JEWISH BOARD OF FAMILY AND CHILDREN'S SERVICES INC SELF-HELP,,,NO ADDRESS,,,moeo_socialservicesiteloactions,1afd798d6bd36b197f70fa8eb4bb1ca1,16,STREET NAME IS MISSING
JEWISH BOARD OF FAMILY AND CHILDREN'S SERVICES INC SUPPORTED HOUSING,,,NO ADDRESS,,,moeo_socialservicesiteloactions,080ad7773384be0121aa35dda2ee05c9,16,STREET NAME IS MISSING
JEWISH CHILD CARE ASSOCIATION OF NEW YORK HOME BASED FAMILY TREATMENT,,,NO ADDRESS,,,moeo_socialservicesiteloactions,9579831db73d73223a7c5ec8a6b07542,16,STREET NAME IS MISSING
LATINO COMMISSION ON AIDS INC HEALTH EDUCATION AND RISK REDUCTION,37-63,83 STREET,37-63 83 STREET,,,moeo_socialservicesiteloactions,fc319d6cc5b4ed8cfafadecccd64e531,EE,'83 STREET' NOT RECOGNIZED. THERE ARE 002 SIMILAR NAMES.
MENTAL HEALTH PROVIDERS OF WESTERN QUEENS INC NON-MEDICAID CARE COORDINATION (OMH),,,NO ADDRESS,,,moeo_socialservicesiteloactions,67e75af86dade50bf018564fa8f9dee2,16,STREET NAME IS MISSING
MERCYFIRST FOSTER CARE,114-58,175 PLACT,114-58 175 PLACT,,,moeo_socialservicesiteloactions,f8a8203cc295f9dd037ac51948c3e4ca,EE,'175TH PLACT' NOT RECOGNIZED. THERE ARE 002 SIMILAR NAMES.
MERCYFIRST FOSTER CARE,4416,SYNDER AVENUE,4416 SYNDER AVENUE,,,moeo_socialservicesiteloactions,cadd0c42528b85267fe878d1ba588fca,11,'SYNDER AVENUE' NOT RECOGNIZED. THERE ARE NO SIMILAR NAMES
MERCYFIRST FOSTER CARE,142-29,ROCKAWAY,142-29 ROCKAWAY,,,moeo_socialservicesiteloactions,8ea9faf4117f000ddaafd254156edddb,EE,'ROCKAWAY' NOT RECOGNIZED. THERE ARE 010 SIMILAR NAMES.
NEW YORK FOUNDLING HOSPITAL FOSTER CARE,997,EAST 179,997 EAST 179,,,moeo_socialservicesiteloactions,a00d53f7a4eeeaa46bb3ebf658b9080c,EE,'EAST 179TH' NOT RECOGNIZED. THERE ARE 003 SIMILAR NAMES.
NEW YORK FOUNDLING HOSPITAL PREVENTIVE SERVICES,590,6 AVENUE/590 AVE OF THE AME,590 6 AVENUE/590 AVE OF THE AME,,,moeo_socialservicesiteloactions,9c5aeb29dab39ab3793bcfd85bea4f61,EE,'6TH AVENUE/590 AVENUE OF THE AME' NOT RECOGNIZED. THERE ARE 007 SIMILAR NAMES.
NEW YORK HARM REDUCTION EDUCATORS INC SUPPORTIVE COUNSELING & FAMILY STABILIZATION SERVICES - SEP,,,NO ADDRESS,,,moeo_socialservicesiteloactions,25bfd8c2c913e47eb3bb513a6afc3271,16,STREET NAME IS MISSING
NEW YORK PRESBYTERIAN HOSPITAL CPEP CRISIS OUTREACH,,,NO ADDRESS,,,moeo_socialservicesiteloactions,f4ff2984e33b41319b807ba606e7a5e8,16,STREET NAME IS MISSING
NEW YORK PRESBYTERIAN HOSPITAL HIV TESTING SERVICES: ROUTINE TESTING IN CLINICAL SETTINGS,,,NO ADDRESS,,,moeo_socialservicesiteloactions,9a71a003fb01c9b31261fa50a437983b,16,STREET NAME IS MISSING
NORTHSIDE CENTER FOR CHILD DEVELOPMENT INC HOME BASED CRISIS INTERVENTION,,,NO ADDRESS,,,moeo_socialservicesiteloactions,d37aee3bf573b7e21a838516ab0a62c1,16,STREET NAME IS MISSING
ODYSSEY HOUSE INC OUTREACH,,,NO ADDRESS,,,moeo_socialservicesiteloactions,49c4047e46353d3cf727070348ff97af,16,STREET NAME IS MISSING
OHEL CHILDREN'S HOME AND FAMILY SERVICES INC SUPPORTED HOUSING,,,NO ADDRESS,,,moeo_socialservicesiteloactions,de6390dd971b203ef68944d8dd298a21,16,STREET NAME IS MISSING
PALLADIA INC SUPPORTED HOUSING,,,NO ADDRESS,,,moeo_socialservicesiteloactions,a4d4dd7d0e0e5f295adf02ebeb72d214,16,STREET NAME IS MISSING
POSTGRADUATE CENTER FOR MENTAL HEALTH ASSERTIVE COMMUNITY TREATMENT,,,NO ADDRESS,,,moeo_socialservicesiteloactions,cde21e4859ab457dea69aa7d66567f67,16,STREET NAME IS MISSING
POSTGRADUATE CENTER FOR MENTAL HEALTH NON-MEDICAID CARE COORDINATION (OMH),,,NO ADDRESS,,,moeo_socialservicesiteloactions,c29627934508c26ada44844ad7bea652,16,STREET NAME IS MISSING
PROJECT HOSPITALITY INC SUPPORTED HOUSING,,,NO ADDRESS,,,moeo_socialservicesiteloactions,a7bcb14bc0eed9ac71c023ecde07cb5a,16,STREET NAME IS MISSING
PROJECT RENEWAL INC HOMELESS PLACEMENT SERVICES (NON-LICENSED PROGRAM),,,NO ADDRESS,,,moeo_socialservicesiteloactions,b20dfb8f4a594198048984020ee21baf,16,STREET NAME IS MISSING
PROJECT RENEWAL INC NY NY III SUPPORTED HOUSING,,,NO ADDRESS,,,moeo_socialservicesiteloactions,e1a3e8b994917558444773f675d78673,16,STREET NAME IS MISSING
PSCH INC NON-MEDICAID CARE COORDINATION (OMH),,,NO ADDRESS,,,moeo_socialservicesiteloactions,b26f3bd661e31c02879f1a5fd87511be,16,STREET NAME IS MISSING
PSCH INC NON-MEDICAID CARE COORDINATION; (NON-LICENSED PROGRAM),,,NO ADDRESS,,,moeo_socialservicesiteloactions,a67c6127b35d7de62f1808e1728e18af,16,STREET NAME IS MISSING
PSCH INC SUPPORTED HOUSING,,,NO ADDRESS,,,moeo_socialservicesiteloactions,0e717cd8b1b08fbec8b611973467913b,16,STREET NAME IS MISSING
"RISING GROUND (FORMERLY - LEAKE AND WATTS SERVICES, INC.) FOSTER CARE",575,SOUNDVIEW,575 SOUNDVIEW,,,moeo_socialservicesiteloactions,0cbf7aa7d29e0ead798ec4524f3deb87,EE,'SOUNDVIEW' NOT RECOGNIZED. THERE ARE 010 SIMILAR NAMES.
SCO FAMILY OF SERVICES GENERAL PREVENTIVE CARE (PC),70-20,47 STREET,70-20 47 STREET,,,moeo_socialservicesiteloactions,718cb3d8076137aff1c039c627f9375a,42,ADDRESS NUMBER OUT OF RANGE
SCO FAMILY OF SERVICES NURSE-FAMILY PARTNERSHIP SERVICES,,,NO ADDRESS,,,moeo_socialservicesiteloactions,f01606c9de879834114efa33a6cebd1d,16,STREET NAME IS MISSING
SCO FAMILY OF SERVICES PREVENTIVE SERVICES,,443-39TH STREET,,,,moeo_socialservicesiteloactions,24a014332cd6dbe1154d3f661c69297a,11,'443-39TH STREET' NOT RECOGNIZED. THERE ARE NO SIMILAR NAMES
SCO FAMILY OF SERVICES SUPPORTED HOUSING,,,NO ADDRESS,,,moeo_socialservicesiteloactions,69a2b5dccde9036cf6ce683e0e87e3bf,16,STREET NAME IS MISSING
ST JOSEPH'S HOSPITAL ASSERTIVE COMMUNITY TREATMENT,,,NO ADDRESS,,,moeo_socialservicesiteloactions,6a26a34e025c55eea1f65c91469bca8c,16,STREET NAME IS MISSING
ST JOSEPH'S HOSPITAL SUPPORTED HOUSING,,,NO ADDRESS,,,moeo_socialservicesiteloactions,305209e23c1098953e714bd0a5f7e78d,16,STREET NAME IS MISSING
ST LUKE'S - ROOSEVELT HOSPITAL CPEP CRISIS OUTREACH,,,NO ADDRESS,,,moeo_socialservicesiteloactions,3f882a7ac58b9924705ca1128f7ea513,16,STREET NAME IS MISSING
ST VINCENT'S SERVICES INC SUPPORTED HOUSING,,,NO ADDRESS,,,moeo_socialservicesiteloactions,0b15dda18385db39c983fe4630edf2e0,16,STREET NAME IS MISSING
STATEN ISLAND BEHAVIORAL NETWORK INC NON-MEDICAID CARE COORDINATION (OMH),,,NO ADDRESS,,,moeo_socialservicesiteloactions,fd29b00518b993b85a542873e13d8c5c,16,STREET NAME IS MISSING
THE BRIDGE INC ASSERTIVE COMMUNITY TREATMENT,,,NO ADDRESS,,,moeo_socialservicesiteloactions,33f3cf389caaa551776eeecc24e65fba,16,STREET NAME IS MISSING
THE BRIDGE INC NON-MEDICAID CARE COORDINATION (OMH),,,NO ADDRESS,,,moeo_socialservicesiteloactions,72dc31f03835943953adeac453a632df,16,STREET NAME IS MISSING
THE BRIDGE INC NY NY III SUPPORTED HOUSING,,,NO ADDRESS,,,moeo_socialservicesiteloactions,6c7c15dd7832720be6e97f3b5be660e9,16,STREET NAME IS MISSING
THE BRIDGE INC SUPPORTED HOUSING,,,NO ADDRESS,,,moeo_socialservicesiteloactions,632d27e7e361c8617a5a582caf21b790,16,STREET NAME IS MISSING
THE CHILD CENTER OF NY INC ADVOCACY SERVICES,,,NO ADDRESS,,,moeo_socialservicesiteloactions,3e475446a341ce481996868f6cc6d570,16,STREET NAME IS MISSING
THE CHILD CENTER OF NY INC HOME BASED CRISIS INTERVENTION,,,NO ADDRESS,,,moeo_socialservicesiteloactions,fc0c52fa6fe4801a9dcffb00bbbf3aa3,16,STREET NAME IS MISSING
THE CHILD CENTER OF NY INC NON-MEDICAID CARE COORDINATION; (NON-LICENSED PROGRAM),,,NO ADDRESS,,,moeo_socialservicesiteloactions,3a27b7c7473dd8eb8393f81c3aa1ed5f,16,STREET NAME IS MISSING
THE CHILD CENTER OF NY INC PREVENTIVE SERVICES,140-15B,SANDFORD AVENUE,140-15B SANDFORD AVENUE,,,moeo_socialservicesiteloactions,67cf657e7fa617c8f440c671e4170c71,EE,'SANDFORD AVENUE' NOT RECOGNIZED. THERE ARE 010 SIMILAR NAMES.
THE CHILDREN'S VILLAGE FOSTER CARE,221-33,45 DRIVE,221-33 45 DRIVE,,,moeo_socialservicesiteloactions,f003460e53b05fbdf602fb80089f5ca0,42,ADDRESS NUMBER OUT OF RANGE
THE CHILDREN'S VILLAGE PREVENTIVE SERVICES,,,,,,moeo_socialservicesiteloactions,a9dd4f95402395a9579ebc6678de5f55,16,STREET NAME IS MISSING
THE DOE FUND INC NY NY III SUPPORTED HOUSING,,,NO ADDRESS,,,moeo_socialservicesiteloactions,b7ac08c84ff89c98c6baf687b587d227,16,STREET NAME IS MISSING
THE FAMILY CENTER INC PREVENTIVE SERVICES,493,MOSTRAND AVENUE,493 MOSTRAND AVENUE,,,moeo_socialservicesiteloactions,17ec2d65f8aba013d4e7fb9df04b515c,EE,'MOSTRAND AVENUE' NOT RECOGNIZED. IS IT 'MOSOMILLO BALLFIELD'?
THE FORTUNE SOCIETY INC SUPPORTED HOUSING,,,NO ADDRESS,,,moeo_socialservicesiteloactions,f777e4f118fe1c7672842375e776e566,98,NO INPUT DATA RECEIVED
THE FRIENDS OF CROWN HEIGHTS EDUCATIONAL CENTERS INC EARLY LEARN NYC: NEW YORK CITY'S EARLY CARE AND EDUCATION SERVICES,49,AVENUE WEST,49 AVENUE WEST,,,moeo_socialservicesiteloactions,c3fbd8886073f8435c506c23f4a3dcc5,EE,'AVENUE WEST' NOT RECOGNIZED. THERE ARE 010 SIMILAR NAMES.
THE HETRICK-MARTIN INSTITUTE INC OUTREACH TO HOMELESS YOUTH,,,NO ADDRESS,,,moeo_socialservicesiteloactions,96e1941e88a300093abc084019ca3c4e,16,STREET NAME IS MISSING
THE JERICHO PROJECT SUPPORTED HOUSING,,,NO ADDRESS,,,moeo_socialservicesiteloactions,1c6a93f556050af485dfb993847426c6,16,STREET NAME IS MISSING
THE MENTAL HEALTH ASSOCIATION OF NEW YORK CITY INC COORDINATED CHILDREN'S SERVICES INITIATIVE,,,NO ADDRESS,,,moeo_socialservicesiteloactions,80791043dbe3f7a0ca1cf2edb54c0983,16,STREET NAME IS MISSING
THE MENTAL HEALTH ASSOCIATION OF NEW YORK CITY INC SELF-HELP,,,NO ADDRESS,,,moeo_socialservicesiteloactions,8b9a197bf347f063da5bbdfcf28f606a,16,STREET NAME IS MISSING
THE MENTAL HEALTH ASSOCIATION OF NEW YORK CITY INC SUPPORTED HOUSING,,,NO ADDRESS,,,moeo_socialservicesiteloactions,f47703c39ca843ffea0fee3ae5bfc4fa,16,STREET NAME IS MISSING
THE NEW YORK FOUNDLING HOSPITAL SCHOOL,,,NO ADDRESS,,,moeo_socialservicesiteloactions,21754536bcc8473ec669ea44aed1f2a9,16,STREET NAME IS MISSING
THE NEW YORK FOUNDLING HOSPITAL SUPPORTED HOUSING,,,NO ADDRESS,,,moeo_socialservicesiteloactions,df7bcc0610bb44746bf4d5dfe800ac58,16,STREET NAME IS MISSING
TRANSITIONAL SERVICES FOR NEW YORK INC NON-MEDICAID CARE COORDINATION (OMH),,,NO ADDRESS,,,moeo_socialservicesiteloactions,7c236d18265c2fbb1d084d1f67eb9143,16,STREET NAME IS MISSING
TRANSITIONAL SERVICES FOR NEW YORK INC OUTREACH,,,NO ADDRESS,,,moeo_socialservicesiteloactions,b488a8acd13cee9e140db96d009f7224,16,STREET NAME IS MISSING
TRANSITIONAL SERVICES FOR NEW YORK INC SUPPORTED HOUSING,,,NO ADDRESS,,,moeo_socialservicesiteloactions,308ac2b2fdcb8ad725fe05d04c7a91bb,16,STREET NAME IS MISSING
TURNAROUND FOR CHILDREN INC SCHOOL,,,NO ADDRESS,,,moeo_socialservicesiteloactions,df46172a172ebdca6c89bea69e331ecd,16,STREET NAME IS MISSING
UNITED COMMUNITY CENTERS INC COMMUNITY-LEVEL INTERVENTIONS FOR HIV PREVENTION,2552,MONTAUK AVENUE,2552 MONTAUK AVENUE,,,moeo_socialservicesiteloactions,bd98d109ea51db25ac588bb77947d7ce,42,ADDRESS NUMBER OUT OF RANGE
UNIVERSITY CONSULTATION AND TREATMENT CENTER FOR MENTAL HYGIENE INC NON-MEDICAID CARE COORDINATION (OMH),,,NO ADDRESS,,,moeo_socialservicesiteloactions,fa6ad812a28319f3d25dd3e22b95a3b9,16,STREET NAME IS MISSING
UNIVERSITY SETTLEMENT SOCIETY OF NEW YORK INC HOME BASED CRISIS INTERVENTION,,,NO ADDRESS,,,moeo_socialservicesiteloactions,569d5af861d030c010d9e3ce1068e4a3,16,STREET NAME IS MISSING
UPPER MANHATTAN MENTAL HEALTH CENTER INC NON-MEDICAID CARE COORDINATION (OMH),,,NO ADDRESS,,,moeo_socialservicesiteloactions,3bd9125986dee649568849644d31f773,16,STREET NAME IS MISSING
URBAN PATHWAYS INC NY NY III SUPPORTED HOUSING,,,NO ADDRESS,,,moeo_socialservicesiteloactions,9b953e6022fd4ef79eb529334c4f9a62,16,STREET NAME IS MISSING
URBAN PATHWAYS INC SUPPORTED HOUSING,,,NO ADDRESS,,,moeo_socialservicesiteloactions,a66315f945b7bdaff32b28425433d080,16,STREET NAME IS MISSING
VISITING NURSE SERVICE OF NEW YORK HOME CARE II ASSERTIVE COMMUNITY TREATMENT,,,NO ADDRESS,,,moeo_socialservicesiteloactions,3e350a992b664db8680c2f4b057d058d,16,STREET NAME IS MISSING
VISITING NURSE SERVICE OF NEW YORK HOME CARE II CRISIS INTERVENTION,,,NO ADDRESS,,,moeo_socialservicesiteloactions,22b647bd019915a818608704d259bba3,16,STREET NAME IS MISSING
VISITING NURSE SERVICE OF NEW YORK HOME CARE II HOME BASED CRISIS INTERVENTION,,,NO ADDRESS,,,moeo_socialservicesiteloactions,3fa10a1194eeb26ca44cb55296a3535c,16,STREET NAME IS MISSING
VISITING NURSE SERVICE OF NEW YORK HOME CARE II NON-MEDICAID CARE COORDINATION (OMH),,,NO ADDRESS,,,moeo_socialservicesiteloactions,fc14780193efaeba11cc48e7bc0cddf2,16,STREET NAME IS MISSING
VISITING NURSE SERVICE OF NEW YORK HOME CARE II NURSE-FAMILY PARTNERSHIP SERVICES,,,NO ADDRESS,,,moeo_socialservicesiteloactions,2c8c1aa630b3ed72dbafcf0e90a04dc2,16,STREET NAME IS MISSING
VISITING NURSE SERVICE OF NEW YORK HOME CARE II OUTREACH,,,NO ADDRESS,,,moeo_socialservicesiteloactions,06e828507f085494a9e562071aebd693,16,STREET NAME IS MISSING
VISITING NURSE SERVICE OF NEW YORK HOME CARE II SCHOOL,,,NO ADDRESS,,,moeo_socialservicesiteloactions,c247ecd973e5b04a8a74696caef40bd9,16,STREET NAME IS MISSING
VOCES LATINAS CORP EARLY INTERVENTION SERVICES: PRIORITY POPULATIONS TESTING IN NON-CLINICAL SETTINGS,,,NO ADDRESS,,,moeo_socialservicesiteloactions,b845ab771486c341226840548bb16438,16,STREET NAME IS MISSING
VOLUNTEERS OF AMERICA - GREATER NEW YORK INC NY NY III SUPPORTED HOUSING,,,NO ADDRESS,,,moeo_socialservicesiteloactions,e40bd41e65ad5038d8754674f61ffe5d,16,STREET NAME IS MISSING
WEILL MEDICAL COLLEGE OF CORNELL UNIVERSITY GERIATRIC MENTAL HEALTH,478,EAST 1 STREET,478 EAST 1 STREET,,,moeo_socialservicesiteloactions,42ed92efc47d46c816613a0548aa8bba,42,ADDRESS NUMBER OUT OF RANGE
WESTON UNITED COMMUNITY RENEWAL INC SUPPORTED HOUSING,,,NO ADDRESS,,,moeo_socialservicesiteloactions,936220c67c6baf989be544f9ca49bfa9,16,STREET NAME IS MISSING
QUEENS DETENTION COMPLEX (QDC),126-01,82 AVENUE,126-01 82ND AVENUE,,11415,nycdoc_corrections,4f3699dcc9358ca794507e80440292ba,00,
CAMPOS PLAZA,611,EAST 13 SREET,611 EAST 13TH SREET,,,nycha_communitycenters,e77bdfe3e7f38ec3aaaaf9e383cf885d,EE,'EAST 13TH SREET' NOT RECOGNIZED. THERE ARE 002 SIMILAR NAMES.
GLENWOOD,5816,FARRAGUT AVENUE,5816 FARRAGUT AVENUE,,,nycha_communitycenters,1ac9ae7aed1f233773a8a6fa3088b253,EE,'FARRAGUT AVENUE' NOT RECOGNIZED. THERE ARE 010 SIMILAR NAMES.
HAMMEL,82-10,RKWAY BEACH BOULEVARD,82-10 RKWAY BEACH BLVD,,,nycha_communitycenters,9d614414e622760cc2165177081b6866,11,'RKWAY BEACH BLVD' NOT RECOGNIZED. THERE ARE NO SIMILAR NAMES
HAMMEL,81-14,RKWAY BEACH BOULEVARD,81-14 RKWAY BEACH BLVD,,,nycha_communitycenters,99387d1376cd2fcec3fb4f3fd00e1d9c,11,'RKWAY BEACH BLVD' NOT RECOGNIZED. THERE ARE NO SIMILAR NAMES
HOWARD,1592,EAST NORTH Y AVENUE,1592 E N Y AVENUE,,,nycha_communitycenters,1abc2f4922b5c7f3944d53fea4f5b333,11,'E N Y AVENUE' NOT RECOGNIZED. THERE ARE NO SIMILAR NAMES
LEXINGTON,115,EAST 98 STEET,115 EAST 98TH STEET,,,nycha_communitycenters,f9552e695859bd351d95be1372b37843,EE,'EAST 98TH STEET' NOT RECOGNIZED. IS IT 'EAST   98 STREET'?
MARINER'S HARBOR,157,BRABANT STEET,157 BRABANT STEET,,,nycha_communitycenters,212e92b69c369837ff8d5889d44064e0,EE,'BRABANT STEET' NOT RECOGNIZED. THERE ARE 010 SIMILAR NAMES.
